{
    "$schema": "../hermes_app_metadata.schema.json",
    "name": "Athena - Project Catalyst Voting",
    "icon": "/srv/www/icons/athena.svg",
    "version": "V2.7.3",
    "description": "Project Catalyst Inovation Platform",
    "about": "About Project Catalyst, long form.\nMulti line.",
    "src": [
        "https://github.com/input-output-hk/hermes",
        "https://github.com/input-output-hk/catalyst-voices"
    ],
    "copyright": [
        "Copyright â’¸ 2024, IOG Singapore."
    ],
    "license": [
        {
            "spdx": "Apache-2.0",
            "file": "/srv/data/apache2.txt",
            "note": "A note"
        },
        {
            "spdx": "MIT",
            "file": "/srv/data/mit.txt"
        },
        {
            "spdx": "Apache-2.0",
            "note": "A note"
        },
        {
            "file": "/srv/data/apache2.txt",
            "note": "A note"
        }
    ],
    "build_date": 1709041814,
    "developer": {
        "name": "IOG Singapore.",
        "contact": "Contact details.",
        "payment": "wallet address"
    },
    "resources": {
        "file-storage": {
            "minimum": 100,
            "requested": 300,
            "maximum": 1024
        },
        "sqlite-db": {
            "minimum": 1024,
            "requested": 4096,
            "maximum": 32768
        }
    },
    "permissions": {
        "admin": true
    }
}